entity,explanation
97. Weather Data,"The data trends and patterns that help to track the atmosphere is known as the weather data. This data basically consists of numbers and factors. Now, real-time data is available that can be used by the organizations in a different manner. Such as a logistics company uses weather data in order to optimize goods transportation."
98. XML Databases,"The databases that support the storage of data in XML format is known as XML database. These databases are generally connected with the document-specific databases. One can export, serial, and put a query on the data of XML database."
99. Yottabyte,It is the big data term related to the measurement of data. One yottabyte is equal to 1000 zettabytes or the data stored in 250 trillion DVDs.
100. ZooKeeper,It is an Apache software project and Hadoop subproject which provides open code name generation for the distributed systems. It also supports consolidated organization of the large-sized distributed systems.
101. Zettabyte,It is the big data term related to the measurement of data. One zettabyte is equal to 1 billion terabytes or 1000 exabytes.
Bottom Line,"Big data is not only a buzz word but the broad term that has a lot to learn. So, we have enlisted and described these Big Data terms that will be helpful in your big data career. Not to mention, it is important to validate your big data skills and knowledge for the bright career. And big data certifications are meant to demonstrate your big data skills to the employers."
